{
    "$schema": "./backtesting_scenarios.schema.json",
    "earnie_data_model": 3,
    "cbc_gap_rel": 0.2,
    "commit_hours": 24,
    "cbc_strict_time_limit_sec": 2,
    "sunrise_full_horizon_trial": true,
    "scenarios": [
        {
            "id": "live",
            "label": "Live",
            "settings": {
                "battery_id": "5_0_kwh_speicher",
                "pv_system_ids": [
                    "dach_sued"
                ],
                "import_tariff_id": "awattar_at",
                "export_tariff_id": "at_tiwag_tiwag_einspeisung_fix",
                "house_profile_id": "example_efh"
            }
        }
    ]
}
