{
  "$schema": "./backtesting_scenarios.schema.json",
  "earnie_data_model": 3,
  "cbc_gap_rel": 0.2,
  "commit_hours": 24,
  "cbc_strict_time_limit_sec": 2,
  "sunrise_full_horizon_trial": true,
  "scenarios": [
    {
      "id": "mit_10_kwh_speicher",
      "label": "Mit 15 kWh Speicher",
      "settings": {
        "battery_id": "10_kwh_speicher",
        "pv_system_ids": [
          "dach_sued"
        ],
        "import_tariff_id": "awattar_at",
        "export_tariff_id": "monthly_sunny",
        "house_profile_id": "example_efh"
      }
    },
    {
      "id": "mein_szenario",
      "label": "Zweite PV-Anlage + 15 kWh Speicher",
      "settings": {
        "battery_id": "10_kwh_speicher",
        "pv_system_ids": [
          "dach_sued",
          "dach_nord"
        ],
        "import_tariff_id": "awattar_at",
        "export_tariff_id": "monthly_sunny",
        "house_profile_id": "example_efh"
      }
    },
    {
      "id": "live",
      "label": "Live",
      "settings": {
        "battery_id": "5_0_kwh_speicher",
        "pv_system_ids": [
          "dach_sued"
        ],
        "import_tariff_id": "awattar_at",
        "export_tariff_id": "at_tiwag_tiwag_einspeisung_fix",
        "house_profile_id": "example_efh"
      }
    },
    {
      "id": "mit_zweiter_pv_anlage",
      "label": "Mit zweiter PV-Anlage",
      "settings": {
        "battery_id": "5_0_kwh_speicher",
        "pv_system_ids": [
          "dach_sued",
          "dach_nord"
        ],
        "import_tariff_id": "awattar_at",
        "export_tariff_id": "monthly_sunny",
        "house_profile_id": "example_efh"
      }
    }
  ]
}
